{
  "$schema": "http://json-schema.org/draft-07/schema#",
  "title": "L3 Semantics Delta",
  "type": "object",
  "required": [
    "layer",
    "version",
    "frame_id",
    "blocks"
  ],
  "properties": {
    "layer": {
      "const": "L3_DELTA"
    },
    "version": {
      "type": "string"
    },
    "frame_id": {
      "type": "string"
    },
    "blocks": {
      "type": "array",
      "items": {
        "type": "object",
        "required": [
          "block_id",
          "resolution",
          "voxels"
        ],
        "properties": {
          "block_id": {
            "type": "string"
          },
          "resolution": {
            "type": "number"
          },
          "voxels": {
            "type": "array",
            "items": {
              "type": "object",
              "required": [
                "ijk"
              ],
              "properties": {
                "ijk": {
                  "type": "array",
                  "items": {
                    "type": "integer"
                  },
                  "minItems": 3,
                  "maxItems": 3
                },
                "logit_delta": {
                  "type": "array",
                  "items": {
                    "type": "number"
                  }
                },
                "dirichlet_delta": {
                  "type": "array",
                  "items": {
                    "type": "number"
                  }
                },
                "instance_id": {
                  "type": "string"
                },
                "merge_hint": {
                  "type": "array",
                  "items": {
                    "type": "string"
                  }
                }
              },
              "anyOf": [
                {
                  "required": [
                    "logit_delta"
                  ]
                },
                {
                  "required": [
                    "dirichlet_delta"
                  ]
                }
              ]
            }
          }
        }
      }
    }
  }
}