{
  "layer": "L3_DELTA",
  "version": "v0.1",
  "frame_id": "world",
  "blocks": [
    {
      "block_id": "b_12_5_9",
      "resolution": 0.2,
      "voxels": [
        {
          "ijk": [
            0,
            0,
            0
          ],
          "logit_delta": [
            0.2,
            -0.1,
            0.0
          ],
          "instance_id": "car#42",
          "merge_hint": [
            "car#42",
            "car#7"
          ]
        }
      ]
    }
  ]
}